{
  "enrollId": "01920000-0000-7000-8000-000000000020",
  "publicKey": "d75a980182b10ab7d54bfed3c964073a0ee172f3daa62325af021a68f707511a",
  "fpStore": "7c7c7c7c7c7c7c7c7c7c7c7c7c7c7c7c7c7c7c7c7c7c7c7c7c7c7c7c7c7c7c7c",
  "fpGlobal": "8d8d8d8d8d8d8d8d8d8d8d8d8d8d8d8d8d8d8d8d8d8d8d8d8d8d8d8d8d8d8d8d",
  "signature": "220f998cedcf7f9996b1655932858bdb0420c5c1d13f96af1a4a782adec28b0e6cb4c7ac6fc56e610a829fdb593210abd5f9993f2650ddc4855968e8e13a5c0c"
}
